{
  "schema_version": "1.0",
  "id": "regulatory_network",
  "name": "Signed regulatory network",
  "format": "tsv",
  "accepted_extensions": [".tsv", ".txt"],
  "description": "Signed regulatory network table used as a structural simulator input. Each row defines one regulator-target effect.",
  "example": "target\tregulator\teffect\nG2\tG1\t1.2\nG3\tG1\t-0.8\nG4\tG2\t0.6",
  "delimiter": "\t",
  "header": true,
  "min_rows": 1,
  "required_columns": ["target", "regulator", "effect"],
  "column_types": {
    "target": "string",
    "regulator": "string",
    "effect": "float"
  },
  "validation_notes": [
    "The target and regulator columns contain simulator gene identifiers.",
    "The effect column must be numeric.",
    "The sign of effect represents activation or repression in the simulator GRN."
  ]
}
