{
  "schema_version": "1.0",
  "id": "syntren_externals_table",
  "name": "SynTReN external input table",
  "format": "tsv",
  "accepted_extensions": [".tsv", ".txt"],
  "description": "SynTReN predefined external-input table consumed when externalInputValues=FROM_EXTERNALS_FILE. Rows are external regulator genes and columns after Regulators are expression experiments or perturbation conditions.",
  "example": "Regulators\texp1a\texp1b\texp2a\ncytR\t0.1\t0.1\t0.5\nrpoE_rseABC\t0.1\t0.8\t0.1",
  "delimiter": "\t",
  "header": true,
  "min_rows": 1,
  "required_columns": ["Regulators"],
  "column_types": {
    "Regulators": "string"
  },
  "validation_notes": [
    "Every column after Regulators must be numeric and is interpreted as one public perturbation/sample column.",
    "Every regulator in the table must exist in the selected SynTReN source network and qualify as an external node for the upstream run.",
    "When this input is used, the wrapper must set fixedExternals=true, selectSubnetwork=false and externalInputValues=FROM_EXTERNALS_FILE."
  ]
}
