{
  "schema_version": "1.0",
  "id": "tree_newick",
  "name": "Differentiation tree",
  "format": "newick",
  "accepted_extensions": [".newick", ".nwk", ".txt"],
  "description": "Newick differentiation tree used as a structural simulator input.",
  "example": "((A:1,B:1):1,C:2);",
  "validation_notes": [
    "The file must contain a valid Newick tree accepted by ape::read.tree.",
    "Leaf labels are interpreted as simulator population or lineage state names.",
    "Branch lengths are passed through to the simulator's tree-based setup when supported."
  ]
}
